{
  "browser": {
    "executablePath": "/opt/offprint/chrome",
    "product": "chrome",
    "protocolVersion": "1.3",
    "revision": "1654411",
    "source": "managed",
    "version": "151.0.7922.47"
  },
  "capturePolicySha256": "0000000000000000000000000000000000000000000000000000000000000000",
  "capturedAt": "2026-07-27T12:00:00Z",
  "environment": {
    "colorScheme": "light",
    "locale": "en-US",
    "reducedMotion": "reduce",
    "timezone": "UTC",
    "userAgent": {
      "kind": "browser-default"
    },
    "viewport": {
      "height": 900,
      "scale": 1,
      "width": 1440
    }
  },
  "formatVersion": 2,
  "frames": 1,
  "generator": {
    "name": "Offprint",
    "version": "0.0.4"
  },
  "resourceRecords": [],
  "resources": {
    "discovered": 0,
    "embedded": 0,
    "embeddedBytes": 0,
    "external": 0,
    "failed": 0,
    "omitted": 0
  },
  "schemaVersion": 2,
  "source": {
    "finalUrl": "https://example.com/",
    "finalUrlSha256": "0000000000000000000000000000000000000000000000000000000000000000",
    "requestedUrl": "https://example.com/",
    "requestedUrlSha256": "0000000000000000000000000000000000000000000000000000000000000000"
  },
  "structuralRepair": {
    "applied": false
  },
  "verificationMode": "offline",
  "viewState": {
    "scrollX": "0",
    "scrollY": "0"
  },
  "warningCodes": []
}
